{
  "schema_version": 1,
  "generated_at": "2026-10-22T00:00:00Z",
  "approval": "approved",
  "content_hash": "bbbbbbbbbbbbbbbbbbbbbbbbbbbbbbbbbbbbbbbbbbbbbbbbbbbbbbbbbbbbbbbb",
  "records": {
    "projects": [
      "harbor",
      "ledger",
      "lumen",
      "tidepool"
    ],
    "profile": "profile.json",
    "relations": "relations.json"
  }
}
